{"candidateId":"candidate-1111111111111111111111111111111111111111-200-1","githubRelease":{"id":"500","tagName":"v0.0.1","url":"https://github.com/greggorio/abaronesa-emporio/releases/tag/v0.0.1"},"kind":"release-publication-outcome","manifestSha256":"sha256:2a56179b2173d28f6026e7aa605337d8b45680e0fd8b219432357e479bd8c239","operationId":"release_operation_0001","recordedAt":"2026-07-29T18:00:00Z","release":"v0.0.1","repository":"greggorio/abaronesa-emporio","schemaVersion":1,"sourceCommit":"1111111111111111111111111111111111111111","status":"published","workflow":{"actor":"example-actor","actorId":"1","attempt":1,"runId":"400","url":"https://github.com/greggorio/abaronesa-emporio/actions/runs/400"}}
